{
  "$schema": "http://json-schema.org/draft-07/schema#",
  "$id": "https://deme.dev/schemas/item.schema.json",
  "title": "Item",
  "description": "An item entity. One entity per file, conventionally content/items/<id>.json.",
  "type": "object",
  "required": ["id", "type", "name"],
  "properties": {
    "id": { "$ref": "common.schema.json#/definitions/entityId" },
    "type": { "const": "item" },
    "name": { "type": "string", "minLength": 1 },
    "description": { "type": "string" },
    "portable": {
      "type": "boolean",
      "description": "Whether the item can be picked up into the player's inventory.",
      "default": true
    },
    "icon": {
      "type": "string",
      "description": "Path to the item's inventory icon asset, relative to the content package root."
    },
    "combinesWithItemIds": {
      "type": "array",
      "description": "References other content/items/*.json entities this item can be combined with.",
      "items": { "$ref": "common.schema.json#/definitions/entityId" },
      "default": []
    },
    "interactions": {
      "type": "array",
      "description": "Script(s) run when the player interacts with this item.",
      "items": { "$ref": "common.schema.json#/definitions/scriptRef" },
      "default": []
    }
  },
  "additionalProperties": false
}
